{
 "research_id": "RP-2026-10-21-omniroute",
 "request_id": "RR-2026-10-21-omniroute",
 "status": "CANDIDATE",
 "produced_at": "2026-10-28T05:33:42Z",
 "question": "Evaluar el repositorio diegosouzapw/OmniRoute (gateway de IA con un endpoint para ~375 proveedores, licencia MIT segun GitHub): que hace exactamente, como guarda y usa las llaves y cuentas de proveedores, que registra o envia a terceros (prompts, telemetria, logs), que dependencias y procedencia tiene su paquete npm e imagen Docker, que terminos de servicio de los proveedores de nivel gratuito permiten o prohiben el uso que propone (acumular niveles gratuitos, cuentas multiples), y como se comporta en un sandbox sin llaves reales.",
 "why_zpmnd_needs_it": "ZPMND quiere aprovechar modelos gratuitos y enrutar cada tarea al modelo mas barato que alcance la calidad (inteligencia elastica), pero un gateway ve todos los prompts y todas las llaves: antes de usarlo necesita saber su riesgo, su legalidad y su comportamiento real.",
 "scope": "Evaluación parcial de OmniRoute (commit d049df5, v3.8.53) solo con lo leído: README, SECURITY, LICENSE, package.json, Dockerfile, flujos de publicación npm y Docker, y módulos de cifrado, registro, Radar y nube. No se leyeron términos de servicio de proveedores, no se ejecutó sandbox y no se calculó sha256.",
 "sources": {
  "primary": [
   "SA-7d2115b406f482420f805c9b",
   "SA-3125bbf19857b46162a81613",
   "SA-5f3caa52b2c2ce5dfb40c854",
   "SA-17b296424841266ce12d4701",
   "SA-2062232926759a82bfcabad1",
   "SA-8576dcef9181ebb92d7466f7",
   "SA-0ee207ca379e40672b58e2af",
   "SA-438211cd7d5a739838bf1d0f",
   "SA-66df44622b0c6bf4d1c4278b",
   "SA-630c8e0e3061bc634fcbeb1b",
   "SA-b2f25111c55460374cd14386",
   "SA-82dce1b987cc592693417287",
   "SA-2d99d23e646285cc16157ef6",
   "SA-12bd7c06231dda9b83bc30f7",
   "SA-a38c87374af722f2f2eac32b",
   "SA-7ba47d99f8e5e45137008d32",
   "SA-32244cd41497e4e01816e792",
   "SA-54fb5cc461d95d4e86a2940a",
   "SA-9276055f78af0fdcc83d7b7e",
   "SA-7e949a9fa663be8a8aa057c9",
   "SA-2b29bea9dc3dd2bdd037a135",
   "SA-97b47777f6460001b7a62f71",
   "SA-0eabf2558e89c75f04a15c1a",
   "SA-66e7532fab913d2bf199cde5",
   "SA-c4433a60442c24eebe5751f3",
   "SA-d26fc82aec2a53ef87c7e538",
   "SA-c9670b453e624aaa2bf96102",
   "SA-7f29ee289e2f548816cb902e",
   "SA-eb826782c9a01932639ad756",
   "SA-3241b0c402e67a33ff8749f4",
   "SA-3db4431a2f4b9fc7a1fa7635",
   "SA-c3f09a86c6edcd341fcb9c8e",
   "SA-6a4983441e4d0f21d61de358",
   "SA-e89da394a69c3d6fca1683b5",
   "SA-7ed91ccd2866aa4ba20fcaf5",
   "SA-827eaab5bd93dca0ad116d9c",
   "SA-3eec7bdcae739ffb37707693",
   "SA-9dd9df9a71a884036aa836fe"
  ],
  "secondary": []
 },
 "artifacts": [
  {
   "artifact_id": "SA-7d2115b406f482420f805c9b",
   "url": "https://raw.githubusercontent.com/cheaper-inference/OmniRoute/d049df5b7c5ac6e15fb03ad4372027a250ab520b/README.md",
   "retrieved_at": "2026-10-28T05:31:46Z",
   "sha256": "7d2115b406f482420f805c9b85676d98c78b056bac262ceac338322470a8ab9c",
   "bytes": 142312,
   "media_type": "text/plain",
   "source_type": "vendor_doc",
   "publisher": "cheaper-inference/OmniRoute en GitHub (antes diegosouzapw/OmniRoute; GitHub redirige el nombre viejo)",
   "license": "MIT (LICENSE del repositorio en ese commit)",
   "redistribution": "allowed",
   "stored_at": "repo",
   "title": "OmniRoute d049df5 README.md (README: qué hace y cómo se usa)"
  },
  {
   "artifact_id": "SA-3125bbf19857b46162a81613",
   "url": "https://raw.githubusercontent.com/cheaper-inference/OmniRoute/d049df5b7c5ac6e15fb03ad4372027a250ab520b/SECURITY.md",
   "retrieved_at": "2026-10-28T05:31:47Z",
   "sha256": "3125bbf19857b46162a81613de383f85902c3ea042fbbdab9d8adfae40c49856",
   "bytes": 16925,
   "media_type": "text/plain",
   "source_type": "vendor_doc",
   "publisher": "cheaper-inference/OmniRoute en GitHub (antes diegosouzapw/OmniRoute; GitHub redirige el nombre viejo)",
   "license": "MIT (LICENSE del repositorio en ese commit)",
   "redistribution": "allowed",
   "stored_at": "repo",
   "title": "OmniRoute d049df5 SECURITY.md (Política de seguridad)"
  },
  {
   "artifact_id": "SA-5f3caa52b2c2ce5dfb40c854",
   "url": "https://raw.githubusercontent.com/cheaper-inference/OmniRoute/d049df5b7c5ac6e15fb03ad4372027a250ab520b/LICENSE",
   "retrieved_at": "2026-10-28T05:31:48Z",
   "sha256": "5f3caa52b2c2ce5dfb40c85404a370d23b6dc3e26a1447d17dc7e56f773b91de",
   "bytes": 1069,
   "media_type": "text/plain",
   "source_type": "vendor_doc",
   "publisher": "cheaper-inference/OmniRoute en GitHub (antes diegosouzapw/OmniRoute; GitHub redirige el nombre viejo)",
   "license": "MIT (LICENSE del repositorio en ese commit)",
   "redistribution": "allowed",
   "stored_at": "repo",
   "title": "OmniRoute d049df5 LICENSE (Licencia MIT del repositorio)"
  },
  {
   "artifact_id": "SA-17b296424841266ce12d4701",
   "url": "https://raw.githubusercontent.com/cheaper-inference/OmniRoute/d049df5b7c5ac6e15fb03ad4372027a250ab520b/THIRD_PARTY_NOTICES.md",
   "retrieved_at": "2026-10-28T05:31:49Z",
   "sha256": "17b296424841266ce12d47019b69373e8f243c03264f5bce48d13543c264db90",
   "bytes": 17202,
   "media_type": "text/plain",
   "source_type": "vendor_doc",
   "publisher": "cheaper-inference/OmniRoute en GitHub (antes diegosouzapw/OmniRoute; GitHub redirige el nombre viejo)",
   "license": "MIT (LICENSE del repositorio en ese commit)",
   "redistribution": "allowed",
   "stored_at": "repo",
   "title": "OmniRoute d049df5 THIRD_PARTY_NOTICES.md (Avisos de terceros (licencias incluidas))"
  },
  {
   "artifact_id": "SA-2062232926759a82bfcabad1",
   "url": "https://raw.githubusercontent.com/cheaper-inference/OmniRoute/d049df5b7c5ac6e15fb03ad4372027a250ab520b/package.json",
   "retrieved_at": "2026-10-28T05:31:50Z",
   "sha256": "2062232926759a82bfcabad156191e46f58319262401939454c58edd76b1e1c6",
   "bytes": 38633,
   "media_type": "text/plain",
   "source_type": "code",
   "publisher": "cheaper-inference/OmniRoute en GitHub (antes diegosouzapw/OmniRoute; GitHub redirige el nombre viejo)",
   "license": "MIT (LICENSE del repositorio en ese commit)",
   "redistribution": "allowed",
   "stored_at": "repo",
   "title": "OmniRoute d049df5 package.json (package.json: dependencias, scripts y archivos publicados)"
  },
  {
   "artifact_id": "SA-8576dcef9181ebb92d7466f7",
   "url": "https://raw.githubusercontent.com/cheaper-inference/OmniRoute/d049df5b7c5ac6e15fb03ad4372027a250ab520b/.npmignore",
   "retrieved_at": "2026-10-28T05:31:51Z",
   "sha256": "8576dcef9181ebb92d7466f7325fbea471bb982f7e2b62a74a09bcded266e5d7",
   "bytes": 2655,
   "media_type": "text/plain",
   "source_type": "code",
   "publisher": "cheaper-inference/OmniRoute en GitHub (antes diegosouzapw/OmniRoute; GitHub redirige el nombre viejo)",
   "license": "MIT (LICENSE del repositorio en ese commit)",
   "redistribution": "allowed",
   "stored_at": "repo",
   "title": "OmniRoute d049df5 .npmignore (.npmignore: qué queda fuera del paquete npm)"
  },
  {
   "artifact_id": "SA-0ee207ca379e40672b58e2af",
   "url": "https://raw.githubusercontent.com/cheaper-inference/OmniRoute/d049df5b7c5ac6e15fb03ad4372027a250ab520b/Dockerfile",
   "retrieved_at": "2026-10-28T05:31:52Z",
   "sha256": "0ee207ca379e40672b58e2af8339890271b8757ea09bade1bb8e436d7c26f714",
   "bytes": 24800,
   "media_type": "text/plain",
   "source_type": "code",
   "publisher": "cheaper-inference/OmniRoute en GitHub (antes diegosouzapw/OmniRoute; GitHub redirige el nombre viejo)",
   "license": "MIT (LICENSE del repositorio en ese commit)",
   "redistribution": "allowed",
   "stored_at": "repo",
   "title": "OmniRoute d049df5 Dockerfile (Dockerfile de la imagen)"
  },
  {
   "artifact_id": "SA-438211cd7d5a739838bf1d0f",
   "url": "https://raw.githubusercontent.com/cheaper-inference/OmniRoute/d049df5b7c5ac6e15fb03ad4372027a250ab520b/.github/workflows/npm-publish.yml",
   "retrieved_at": "2026-10-28T05:31:53Z",
   "sha256": "438211cd7d5a739838bf1d0fd1e130dfd54d9758b625cbbae637daf0ba9f6643",
   "bytes": 32935,
   "media_type": "text/plain",
   "source_type": "code",
   "publisher": "cheaper-inference/OmniRoute en GitHub (antes diegosouzapw/OmniRoute; GitHub redirige el nombre viejo)",
   "license": "MIT (LICENSE del repositorio en ese commit)",
   "redistribution": "allowed",
   "stored_at": "repo",
   "title": "OmniRoute d049df5 .github/workflows/npm-publish.yml (Flujo de publicación npm (procedencia))"
  },
  {
   "artifact_id": "SA-66df44622b0c6bf4d1c4278b",
   "url": "https://raw.githubusercontent.com/cheaper-inference/OmniRoute/d049df5b7c5ac6e15fb03ad4372027a250ab520b/.github/workflows/docker-publish.yml",
   "retrieved_at": "2026-10-28T05:31:54Z",
   "sha256": "66df44622b0c6bf4d1c4278b9fa14e971dab4849becc85ffe636156de696dc8a",
   "bytes": 35696,
   "media_type": "text/plain",
   "source_type": "code",
   "publisher": "cheaper-inference/OmniRoute en GitHub (antes diegosouzapw/OmniRoute; GitHub redirige el nombre viejo)",
   "license": "MIT (LICENSE del repositorio en ese commit)",
   "redistribution": "allowed",
   "stored_at": "repo",
   "title": "OmniRoute d049df5 .github/workflows/docker-publish.yml (Flujo de publicación de la imagen Docker (procedencia))"
  },
  {
   "artifact_id": "SA-630c8e0e3061bc634fcbeb1b",
   "url": "https://raw.githubusercontent.com/cheaper-inference/OmniRoute/d049df5b7c5ac6e15fb03ad4372027a250ab520b/src/lib/db/encryption.ts",
   "retrieved_at": "2026-10-28T05:31:55Z",
   "sha256": "630c8e0e3061bc634fcbeb1b1eb6e1443a52b76c7404af5964c1de9c411aa2ed",
   "bytes": 20230,
   "media_type": "text/plain",
   "source_type": "code",
   "publisher": "cheaper-inference/OmniRoute en GitHub (antes diegosouzapw/OmniRoute; GitHub redirige el nombre viejo)",
   "license": "MIT (LICENSE del repositorio en ese commit)",
   "redistribution": "allowed",
   "stored_at": "repo",
   "title": "OmniRoute d049df5 src/lib/db/encryption.ts (Cifrado de columnas en la base local)"
  },
  {
   "artifact_id": "SA-b2f25111c55460374cd14386",